{
  "type": "object",
  "$schema": "http://json-schema.org/draft-04/schema#",
  "properties": {
    "modifiedDate": {
      "$ref": "#/definitions/datePattern"
    },
    "updatedOffences": {
      "type": "array",
      "items": {
        "properties": {
          "defendantId": {
            "$ref": "http://justice.gov.uk/json/schemas/core/data-types.json#/definitions/uuid"
          },
          "caseId": {
            "$ref": "http://justice.gov.uk/json/schemas/core/data-types.json#/definitions/uuid"
          },
          "offences": {
            "type": "array",
            "items": {
              "$ref": "http://justice.gov.uk/progression/events/public.progression.offence.json"
            }
          }
        },
        "required": [
          "defendantId",
          "caseId",
          "offences"
        ]
      }
    },
    "deletedOffences": {
      "type": "array",
      "items": {
        "properties": {
          "defendantId": {
            "$ref": "http://justice.gov.uk/json/schemas/core/data-types.json#/definitions/uuid"
          },
          "caseId": {
            "$ref": "http://justice.gov.uk/json/schemas/core/data-types.json#/definitions/uuid"
          },
          "offences": {
            "type": "array",
            "items": {
              "$ref": "http://justice.gov.uk/json/schemas/core/data-types.json#/definitions/uuid"
            }
          }
        },
        "required": [
          "defendantId",
          "caseId",
          "offences"
        ]
      }
    },
    "addedOffences": {
      "type": "array",
      "items": {
        "properties": {
          "defendantId": {
            "$ref": "http://justice.gov.uk/json/schemas/core/data-types.json#/definitions/uuid"
          },
          "caseId": {
            "$ref": "http://justice.gov.uk/json/schemas/core/data-types.json#/definitions/uuid"
          },
          "offences": {
            "type": "array",
            "items": {
              "$ref": "http://justice.gov.uk/progression/events/public.progression.offence.json"
            }
          }
        },
        "required": [
          "defendantId",
          "caseId",
          "offences"
        ]
      }
    }
  },
  "required": [
    "modifiedDate"
  ],
  "definitions": {
    "datePattern": {
      "type": "string",
      "pattern": "^((([\\+-]?\\d{4}(?!\\d{2}\\b))\\-(0[13578]|1[02])\\-(0[1-9]|[12]\\d|3[01]))|(([\\+-]?\\d{4}(?!\\d{2}\\b))\\-(0[13456789]|1[012])\\-(0[1-9]|[12]\\d|30))|(([\\+-]?\\d{4}(?!\\d{2}\\b))\\-02\\-(0[1-9]|1\\d|2[0-8]))|(((1[6-9]|[2-9]\\d)(0[48]|[2468][048]|[13579][26])|((16|[2468][048]|[3579][26])00))\\-02\\-29))$"
    }
  }
}